<?xml version="1.0" encoding="UTF-8" standalone="no"?>
<!DOCTYPE student-records SYSTEM "student.dtd">

<student-records>
  <student name="Gordon Matthew Sumner">
    <preferred-name>Sting</preferred-name>
    <student-id>1234567</student-id>
    <email>sting@thepolice.com</email>
    <phone>212.123.4567</phone>
  </student>
  <student name="Kim Thayil">
    <student-id>4567890</student-id>
    <email>kim@soundgarden.com</email>
    <phone>206.123.4567</phone>
  </student>
  <student name="Saul Hudson">
    <preferred-name>Slash</preferred-name>
    <student-id>8302438</student-id>
    <email>slash@gnr.com</email>
    <phone>213.456.8392</phone>
  </student>
  <student name="Emily Kokal">
    <student-id>2983928</student-id>
    <email>emily@warpaint.com</email>
    <phone>213.123.7654</phone>
  </student>
  <student name="Mike Inez">
    <student-id>7645726</student-id>
    <email>mike@aic.com</email>
    <phone> 213.444.3323</phone>
  </student>
</student-records>
